{
  "schema_version": "1.0",
  "figure_id": "mechanism",
  "canvas": {"aspect_ratio": 2.0, "width": 180, "height": 90},
  "nodes": [
    {
      "node_id": "receptor",
      "node_type": "image_asset",
      "asset_id": "receptor",
      "panel_id": "a",
      "z_order": 1,
      "bbox": [0.1, 0.2, 0.3, 0.5]
    }
  ],
  "connectors": [],
  "groups": [],
  "labels": [],
  "conflicts": []
}
